{"annotations_json":"revisions/bf07c496e42a10f3e219ec4a2a77640097aa8578ec60af52b63f739ab13d4910/annotations.json","annotations_json_sha256":"4ffc8e0969c22c61501ed0794c5e025203fe89f3932b9bdf12cebe2ac2166439","detached_package":"revisions/bf07c496e42a10f3e219ec4a2a77640097aa8578ec60af52b63f739ab13d4910/second-reader-agent-94da560b3600.annotations","detached_package_sha256":"4dba6f51c87ae309be6eeb15059cb395e66a796feb0c8f995fab64c9f98892b3","revision_id":"bf07c496e42a10f3e219ec4a2a77640097aa8578ec60af52b63f739ab13d4910","schema_version":"annotation-pack-publication-pointer/0.1","semantic_digest":"f7dac5e98d6cf0743122950ea4e2f27bf5fab67175e22889d10cef63e0c476e2","track_id":"urn:uuid:94da560b-3600-5820-adb6-070fd907f32a","validation_report":"revisions/bf07c496e42a10f3e219ec4a2a77640097aa8578ec60af52b63f739ab13d4910/validation-report.json","validation_report_sha256":"71c48c2705c456eab6ddc80a56daebb78dfbc8770993239f7937bf9eeb794e6e"}
